### ISSUE TITLE
wrong snat/masquerade  on udp

### ISSUE THREAD

**Issue by bugsyb** [moby/libnetwork#2594]
Communication is container => port exposed on Docker Host IP mapped to => container.
Containers are each sitting in different subnet and as such routing goes as above.
The 

What works is TCP
```
16:44:52.049411   P 02:42:ac:14:02:03 ethertype IPv4 (0x0800), length 76: 10.20.9.10.46102 > 192.168.0.5.10080: Flags [S], seq 1523078290, win 64240, options [mss 1357,sackOK,TS val 3454598927 ecr 0,nop,wscale 7], length 0
16:44:52.049411  In 02:42:ac:14:02:03 ethertype IPv4 (0x0800), length 76: 10.20.9.10.46102 > 192.168.0.5.10080: Flags [S], seq 1523078290, win 64240, options [mss 1357,sackOK,TS val 3454598927 ecr 0,nop,wscale 7], length 0
16:44:52.049467 Out 02:42:54:e2:bc:ac ethertype IPv4 (0x0800), length 76: 192.168.0.5.10080 > 10.20.9.10.46102: Flags [S.], seq 2357073271, ack 1523078291, win 28960, options [mss 1460,sackOK,TS val 60712 ecr 3454598927,nop,wscale 7], length 0
16:44:52.049471 Out 02:42:54:e2:bc:ac ethertype IPv4 (0x0800), length 76: 192.168.0.5.10080 > 10.20.9.10.46102: Flags [S.], seq 2357073271, ack 1523078291, win 28960, options [mss 1460,sackOK,TS val 60712 ecr 3454598927,nop,wscale 7], length 0
```
but UDP show additional source nat (masquerade) to IP of docker on the destination container subnet, not only when going down the path to the container, but what is worse on the way back from server container back to client.
```
16:46:10.580292   P 02:42:ac:14:02:03 ethertype IPv4 (0x0800), length 71: 10.20.9.10.56562 > 192.168.0.5.53: 24010+ A? test.domain. (27)
16:46:10.580292  In 02:42:ac:14:02:03 ethertype IPv4 (0x0800), length 71: 10.20.9.10.56562 > 192.168.0.5.53: 24010+ A? test.domain. (27)
16:46:10.580745 Out 02:42:81:f5:f6:89 ethertype IPv4 (0x0800), length 71: 172.20.0.1.50503 > 172.20.0.4.53: 24010+ A? test.domain. (27)
16:46:10.580754 Out 02:42:81:f5:f6:89 ethertype IPv4 (0x0800), length 71: 172.20.0.1.50503 > 172.20.0.4.53: 24010+ A? test.domain. (27)
16:46:10.581312   P 02:42:ac:14:00:04 ethertype IPv4 (0x0800), length 87: 172.20.0.4.53 > 172.20.0.1.50503: 24010* 1/0/0 A 192.168.0.5 (43)
16:46:10.581312  In 02:42:ac:14:00:04 ethertype IPv4 (0x0800), length 87: 172.20.0.4.53 > 172.20.0.1.50503: 24010* 1/0/0 A 192.168.0.5 (43)
16:46:10.581443 Out 02:42:54:e2:bc:ac ethertype IPv4 (0x0800), length 87: 172.20.2.1.53 > 10.20.9.10.56562: 24010* 1/0/0 A 192.168.0.5 (43)
16:46:10.581472 Out 02:42:54:e2:bc:ac ethertype IPv4 (0x0800), length 87: 172.20.2.1.53 > 10.20.9.10.56562: 24010* 1/0/0 A 192.168.0.5 (43)
```
Legend:
- 10.20.9.10 - real client IP (behind VPN and outside of docker IP space), which reaches docker via VPN gateway 
- 172.20.2.0/24 - subnet on which VPN gateway container is,
- 192.168.0.5 - real docker host IP on its LAN interface where ports are exposed.,
- 172.20.0.4 - container of which ports are exposed on docker host IP (let's call it server),
- 172.20.0.1 - docker IP on that server container subnet
- 172.20.2.1 - docker IP on the VPN gateway container.

The problem is that the reply packet is effectively reaching the container initiating communication with wrong src IP (172.20.2.1) on the subnet of the client container which in this case is VPN gateway. As result, whilst packet is forwarded back via VPN, is dropped on client side as is coming with wrong IP.

Surprisingly nothing like this happens for TCP communication.
There are no manual iptables nat rules which would cause situation like this.
Tests were performed with high ports too to exclude specific behavior on port 53.

```
Client:
 Version:           18.09.7
 API version:       1.39
 Go version:        go1.12.6
 Git commit:        18.09.7
 Built:             Wed Nov 27 08:45:51 UTC 2019
 OS/Arch:           linux/arm
 Experimental:      false

Server:
 Engine:
  Version:          18.09.7
  API version:      1.39 (minimum version 1.12)
  Go version:       go1.12.6
  Git commit:       18.09.7
  Built:            Wed Nov 27 08:45:51 UTC 2019
  OS/Arch:          linux/arm
  Experimental:     true
```

Unfortunately can't simply bump docker version just for tests as it is CoreElec image.
Is it a known issue and I just couldn't find a reference ticket?
